{
  "schemaVersion": 1,
  "reviewDate": "2026-10-12",
  "references": [
    {
      "id": "nuri-2019",
      "kind": "official-curriculum",
      "version": "2019 Revised Nuri Curriculum; Ministry of Education notice and explanatory materials (official packet posted 2020-01-02)",
      "reviewedOn": "2026-10-12",
      "title": {
        "en": "2019 Revised Nuri Curriculum — official notice and explanatory guide",
        "ko": "2019 개정 누리과정 고시문·해설서"
      },
      "url": "https://www.moe.go.kr/boardCnts/view.do?boardID=312&boardSeq=79419&lev=0&m=03",
      "use": {
        "en": "Official common curriculum for ages 3–5: five integrated domains and play-centered, locally adaptable practice. My stage strands are an editorial crosswalk, not official standards or a compliance checklist.",
        "ko": "만 3~5세 국가 공통 교육과정의 5개 통합 영역과 놀이 중심·현장 자율성을 참고합니다. 서가의 단계·주제는 편집상 연결이며 공식 성취기준이나 준수 점검표가 아닙니다."
      },
      "reuseLimit": {
        "en": "The source page indicates attribution, non-commercial, and no-derivatives conditions. This project uses citation metadata and links only; it does not reproduce or adapt Nuri text, activity content, or artwork.",
        "ko": "원문 페이지에는 출처표시·비영리·변경금지 조건이 표시되어 있습니다. 이 프로젝트는 서지 정보와 링크만 사용하며 누리과정 문구·활동 내용·미술 자료를 복제하거나 각색하지 않습니다."
      }
    },
    {
      "id": "national-2022-math",
      "kind": "official-curriculum",
      "version": "Ministry of Education Notice 2022-33 (2022-12-22), Elementary/Middle/High Mathematics Curriculum, Appendix 8",
      "reviewedOn": "2026-10-12",
      "title": {
        "en": "2022 Revised National Curriculum — mathematics Appendix 8",
        "ko": "2022 개정 수학과 교육과정 별책 8"
      },
      "url": "https://www.moe.go.kr/boardCnts/viewRenew.do?boardID=141&boardSeq=93458&lev=0&search=",
      "use": {
        "en": "Primary official source for the mathematics curriculum. The site offers a broad concept progression and is not a line-by-line standards crosswalk.",
        "ko": "수학과 교육과정의 공식 원문을 참고합니다. 이 사이트의 개념 흐름은 폭넓은 편집 지도이며 성취기준별 대응표가 아닙니다."
      }
    },
    {
      "id": "national-2022-general",
      "kind": "official-curriculum",
      "version": "Ministry of Education Notice 2022-33 (2022-12-22), revised general and subject curricula; amendment lineage through National Education Commission Notices 2024-3 and 2026-1",
      "reviewedOn": "2026-10-12",
      "title": {
        "en": "2022 Revised National Curriculum — general and subject curriculum records",
        "ko": "2022 개정 초·중등학교 교육과정 총론 및 교과 교육과정"
      },
      "url": "https://www.moe.go.kr/boardCnts/viewRenew.do?boardID=141&boardSeq=93458&lev=0&search=",
      "use": {
        "en": "Official context for broad school-stage subject strands and staged implementation. Later notices 2024-3 and 2026-1 amended specified appendices; consult the source register for scope. Portal concepts are editorial examples, not a complete standards or compliance map.",
        "ko": "학교급별 주제 흐름과 단계적 시행을 위한 공식 맥락입니다. 후속 고시 2024-3호와 2026-1호는 지정 별책을 일부 개정했으며 범위는 출처 등록표를 참고하세요. 포털 개념은 편집상 예시이며 전체 성취기준이나 준수 대응표가 아닙니다."
      }
    },
    {
      "id": "national-2024-amendment",
      "kind": "official-curriculum",
      "version": "National Education Commission Notice 2024-3 (2024-08-16), partial amendment to Notice 2022-33; listed appendices 1–4, 7, 12, 14, 18, 19, 22, 23–39, and 41; Appendix 8 not listed",
      "reviewedOn": "2026-10-12",
      "title": {
        "en": "2024 partial amendment to the 2022 National Curriculum",
        "ko": "2022 개정 교육과정 2024년 일부 개정"
      },
      "url": "https://www.ne.go.kr/user/bbs/BD_selectBbs.do?q_bbsDocNo=20240927163706792&q_bbsSn=1016",
      "use": {
        "en": "The official 2024 notice partially amends the 2022 curriculum and enumerates the affected appendices. Mathematics Appendix 8 is not listed in that amendment; this statement is limited to the notice scope, not a claim that no other notice can apply.",
        "ko": "2024년 공식 고시는 2022 개정 교육과정의 일부를 개정하고 대상 별책을 열거합니다. 이 고시의 개정 목록에 수학 별책 8은 없습니다. 이는 해당 고시의 범위에 한정한 설명이며 다른 고시가 없다는 뜻은 아닙니다."
      }
    },
    {
      "id": "national-2026-amendment",
      "kind": "official-curriculum",
      "version": "National Education Commission Notice 2026-1 (2026-01-21), partial amendment to Notice 2024-3, listing Appendices 1–4 and 15; Appendix 8 not listed",
      "reviewedOn": "2026-10-12",
      "title": {
        "en": "2026 partial amendment to the 2022 National Curriculum",
        "ko": "2022 개정 교육과정 2026년 일부 개정"
      },
      "url": "https://www.ne.go.kr/new/user/bbs/BD_selectBbs.do?q_bbsDocNo=20260121102419070&q_bbsSn=1016",
      "use": {
        "en": "Checked the latest listed partial-amendment scope as of 2026-10-12: this notice amends Appendices 1–4 and 15 of Notice 2024-3. Mathematics Appendix 8 is not listed in either the 2024-3 or 2026-1 amendment notice. This is a bounded notice review, not a guarantee against later changes.",
        "ko": "2026-10-12 기준으로 최신 일부 개정 범위를 확인했습니다. 이 고시는 2024-3호의 별책 1–4 및 15를 개정합니다. 수학 별책 8은 2024-3호 및 2026-1호의 개정 목록에 없습니다. 이는 확인한 고시 범위에 한정하며 이후 변경 가능성을 배제하지 않습니다."
      }
    },
    {
      "id": "naeyc-dap",
      "kind": "professional-guidance",
      "version": "Developmentally Appropriate Practice Position Statement, 4th edition (2020)",
      "reviewedOn": "2026-10-12",
      "title": {
        "en": "NAEYC Developmentally Appropriate Practice Position Statement",
        "ko": "NAEYC 발달에 적합한 실제 입장문"
      },
      "url": "https://www.naeyc.org/resources/position-statements/dap/contents",
      "use": {
        "en": "Professional recommendation: strengths-based, play-based, joyful learning; account for common development, individual experience, and cultural/linguistic context. This is guidance, not Korean law.",
        "ko": "전문가 권고: 강점과 놀이를 바탕으로 즐겁게 배우고, 공통 발달·개별 경험·문화·언어 맥락을 함께 고려합니다. 한국 법령이나 교육과정 고시는 아닙니다."
      }
    },
    {
      "id": "mit-math-catalog",
      "kind": "university-catalog",
      "version": "MIT Bulletin 2026–2027, Course 18 subject catalog and Mathematics degree chart (reviewed 2026-10-12)",
      "reviewedOn": "2026-10-12",
      "title": {
        "en": "MIT Mathematics Course 18 catalog and degree chart",
        "ko": "MIT 수학과 Course 18 과목 안내 및 학위 이수표"
      },
      "url": "https://catalog.mit.edu/degree-charts/mathematics-course-18/",
      "use": {
        "en": "One current university example for prerequisite dependencies among calculus, linear algebra, differential equations, probability/statistics, and numerical analysis. MIT requirements are not universal.",
        "ko": "미적분·선형대수·미분방정식·확률통계·수치해석의 선행 관계를 살펴보는 한 대학의 최신 사례입니다. MIT 요건이 보편 규칙은 아닙니다."
      }
    },
    {
      "id": "nrc-early-math",
      "kind": "research-report",
      "version": "National Research Council (2009), Mathematics Learning in Early Childhood: Paths Toward Excellence and Equity, National Academies Press, DOI 10.17226/12519",
      "reviewedOn": "2026-10-12",
      "title": {
        "en": "Mathematics Learning in Early Childhood (NRC, 2009)",
        "ko": "유아 수학 학습 (미국 국립연구위원회, 2009)"
      },
      "url": "https://www.nationalacademies.org/publications/12519",
      "use": {
        "en": "Research synthesis and recommendations on early mathematical learning; informs playful attention to number, operations, shape, space, and development. It is not Korean curriculum or a prescribed activity sequence.",
        "ko": "유아 수학 학습의 연구 종합과 권고로 수·연산·모양·공간·발달에 대한 놀이 중심 관점을 참고합니다. 한국 교육과정이나 정해진 활동 순서가 아닙니다."
      }
    },
    {
      "id": "nasem-preschool-curriculum",
      "kind": "research-report",
      "version": "National Academies of Sciences, Engineering, and Medicine (2024), A New Vision for High-Quality Preschool Curriculum, National Academies Press, DOI 10.17226/27429; publisher suggested citation states 2024",
      "reviewedOn": "2026-10-12",
      "title": {
        "en": "A New Vision for High-Quality Preschool Curriculum (NASEM, 2024)",
        "ko": "양질의 유아교육과정에 대한 새로운 비전 (미국 국립학술원, 2024)"
      },
      "url": "https://www.nationalacademies.org/read/27429/chapter/5",
      "use": {
        "en": "Evidence and recommendations for integrated, joyful preschool learning, including dialogic reading and foundational spatial/mathematical ideas. U.S.-context professional evidence, not Korean legal requirements.",
        "ko": "대화형 읽기와 기초 공간·수학 개념을 포함하는 통합적이고 즐거운 유아 학습의 근거와 권고입니다. 미국 맥락의 전문가 근거이며 한국의 법적 요건이 아닙니다."
      }
    }
  ],
  "stages": [
    {
      "id": "preschool",
      "order": 1,
      "ageRange": {
        "min": 3,
        "max": 5
      },
      "label": {
        "en": "Preschool · ages 3–5",
        "ko": "유아기 · 만 3~5세"
      },
      "description": {
        "en": "Illustrated stories, shared read-aloud, conversation, movement, and everyday discovery can lead. Optional prompts or taps add to the story without becoming an academic target.",
        "ko": "그림책 함께 읽기·대화·움직임·일상 속 발견이 중심이 될 수 있습니다. 선택형 질문이나 터치는 학업 목표가 아니라 이야기를 풍성하게 합니다."
      },
      "guidanceOnly": true
    },
    {
      "id": "early-elementary",
      "order": 2,
      "ageRange": {
        "min": 6,
        "max": 8
      },
      "label": {
        "en": "Early elementary · approx. ages 6–8",
        "ko": "초등 저학년 · 약 6~8세"
      },
      "description": {
        "en": "Build confidence through concrete examples, stories, drawing, conversation, and gentle practice. Readiness and school timing vary.",
        "ko": "구체물·이야기·그림·대화·부담 없는 연습으로 자신감을 쌓습니다. 준비도와 학교 진도는 다를 수 있습니다."
      },
      "guidanceOnly": true
    },
    {
      "id": "upper-elementary",
      "order": 3,
      "ageRange": {
        "min": 9,
        "max": 11
      },
      "label": {
        "en": "Upper elementary · approx. ages 9–11",
        "ko": "초등 고학년 · 약 9~11세"
      },
      "description": {
        "en": "Connect models, observations, and explanations; revisit earlier ideas in new contexts. This is flexible guidance.",